{
  "id": "mdpi-materials",
  "name": "Materials (MDPI)",
  "url": "https://www.mdpi.com/journal/materials",
  "source_type": "journal",
  "sectors": [
    "UPS",
    "MID",
    "H2"
  ],
  "disciplines": [
    "MAT"
  ],
  "publisher_org": "MDPI AG",
  "country": "CH",
  "regions": [
    "global"
  ],
  "access": "open",
  "licence": "CC-BY-4.0",
  "reuse_level": "full-text-open",
  "quality_tier": 1,
  "update_frequency": "weekly",
  "verification": "verified",
  "last_verified": "2026-10-23",
  "notes": "MDPI publishes all articles under the latest CC BY licence; attribution required. Evidence: https://www.mdpi.com/openaccess",
  "feeds": [
    "https://www.mdpi.com/rss/journal/materials"
  ]
}
