{
  "id": "spe-apogce",
  "name": "SPE Asia Pacific Oil & Gas Conference (APOGCE)",
  "url": "https://www.spe.org/events/en/",
  "source_type": "conference",
  "sectors": [
    "UPS",
    "GAS",
    "CCS"
  ],
  "disciplines": [
    "DIG"
  ],
  "publisher_org": "SPE",
  "country": "INT",
  "regions": [
    "apac"
  ],
  "access": "mixed",
  "licence": "proprietary",
  "reuse_level": "catalog-only",
  "quality_tier": 1,
  "update_frequency": "irregular",
  "notes": "Papers in OnePetro.",
  "verification": "unverified",
  "last_verified": null
}
