{
  "id": "whec",
  "name": "World Hydrogen Energy Conference (WHEC)",
  "url": "https://www.iahe.org/",
  "source_type": "conference",
  "sectors": [
    "H2"
  ],
  "disciplines": [
    "PRC",
    "MAT"
  ],
  "publisher_org": "International Association for Hydrogen Energy",
  "country": "INT",
  "regions": [
    "global"
  ],
  "access": "mixed",
  "licence": "proprietary",
  "reuse_level": "catalog-only",
  "quality_tier": 2,
  "update_frequency": "irregular",
  "verification": "unverified",
  "last_verified": null
}
