{
  "id": "igu",
  "name": "International Gas Union",
  "url": "https://www.igu.org/",
  "source_type": "association",
  "sectors": [
    "GAS",
    "MID",
    "H2"
  ],
  "disciplines": [
    "DIG"
  ],
  "publisher_org": "International Gas Union",
  "country": "INT",
  "regions": [
    "global"
  ],
  "access": "open",
  "licence": "proprietary",
  "reuse_level": "full-text-restricted",
  "quality_tier": 2,
  "update_frequency": "annual",
  "notes": "World LNG Report.",
  "verification": "unverified",
  "last_verified": null
}
