{
  "id": "osdu",
  "name": "OSDU Data Platform (The Open Group)",
  "url": "https://www.opengroup.org/osdu-forum/",
  "source_type": "association",
  "sectors": [
    "UPS",
    "MID"
  ],
  "disciplines": [
    "DIG"
  ],
  "publisher_org": "The Open Group",
  "country": "US",
  "regions": [
    "global"
  ],
  "access": "open",
  "licence": "Apache-2.0",
  "reuse_level": "full-text-open",
  "quality_tier": 2,
  "update_frequency": "monthly",
  "notes": "osduforum.org now redirects to The Open Group OSDU Forum page; code licence not yet confirmed. Evidence: https://www.opengroup.org/osdu-forum/",
  "verification": "unverified",
  "last_verified": null
}
