{
  "id": "spe-journal",
  "name": "SPE Journal",
  "url": "https://onepetro.org/SJ",
  "source_type": "journal",
  "sectors": [
    "UPS",
    "CCS"
  ],
  "disciplines": [
    "PRC",
    "DIG"
  ],
  "publisher_org": "Society of Petroleum Engineers",
  "country": "US",
  "regions": [
    "global"
  ],
  "access": "paywalled",
  "licence": "proprietary",
  "reuse_level": "catalog-only",
  "quality_tier": 1,
  "update_frequency": "monthly",
  "verification": "unverified",
  "last_verified": null
}
